{
  "id": "figma-com-design-fop5ul1ytdyrmdgqvg81ho-51-yc-f25-startup-websites-fully",
  "url": "https://figma.com/design/fOP5uL1YtdYRmdGQvg81ho/51--YC-F25-Startup-Websites---Fully-Editable-YCombinator-Startup-Websites--Community-?node-id=0-1&p=f",
  "kind": "page",
  "hints_hash": "87bd8fb858b7b74c",
  "schema_version": 1,
  "extracted_at": "2026-10-11T21:39:17Z",
  "extractor": {"agent": "omp", "model": "deepseek-v4.1-flash", "prompt": "metadata-v2"},
  "evidence": [
    {"url": "https://figma.com/design/fOP5uL1YtdYRmdGQvg81ho/51--YC-F25-Startup-Websites---Fully-Editable-YCombinator-Startup-Websites--Community-?node-id=0-1&p=f", "title": "Figma", "status": null},
    {"url": "https://www.figma.com/community/file/1575306290250273138/51-yc-f25-startup-websites-fully-editable-ycombinator-startup-websites", "title": "51+ YC F25 Startup Websites - Fully Editable YCombinator Startup Websites | Figma", "status": 200}
  ],
  "status": "partial",
  "name": "51+ YC F25 Startup Websites",
  "summary": "Figma Community design file with over 50 editable website designs from Y Combinator's Fall 2025 (F25) batch.",
  "description": "A Figma Community design file collecting over 50 editable website designs from startups in Y Combinator's Fall 2025 batch. Open it in Figma to browse, remix and edit the layouts.",
  "type": "template",
  "keywords": ["figma", "design file", "landing page", "startup website", "web design", "ui kit", "template", "editable", "ycombinator", "saas", "marketing site", "page layout"],
  "formats": ["figma-file"],
  "related": {"repo": null, "docs": null, "npm": null, "figma": null, "parent": "figma-com"},
  "confidence": 0.6
}
